ctmsId,externalId,namespace,contentType,createdAt,sourceLanguage,sourceText,targetLanguage,enReferenceTranslation,targetText,contentId,translationProvider,productViewCount,productRevenue,productURL,Evaluation,Root Cause,Comment,arabic_percentage
product-core_content-description_313155533_1,313155533_1,product-core,content-description,2025-05-08 03:56:54.140301 UTC,tr-tr,Puma Skye Clean Sneaker,ar-ae,,حذاء رياضي بوما سكاي كلين,313155533,Alibaba,2126294.0,25190,https://www.trendyol.com/ar/pname-p-313155533,OK,,,100.0
product-core_content-description_887263146_1,887263146_1,product-core,content-description,2025-05-12 19:49:07.014951 UTC,tr-tr,ADİDAS Erkek GÜNLÜK AYAKKABI GRAND COURT BASE 2.0 JH8610,ar-ae,,أديداس حذاء رجالي يومي جراند كورت بيس 2.0 JH8610,887263146,Alibaba,8817939.0,63440,https://www.trendyol.com/ar/pname-p-887263146,OK,,,79.48717948717949
prod-qna_prod-qna_42713792_300725793_a,42713792_300725793_a,prod-qna,prod-qna,2025-03-18 08:37:08.897884 UTC,tr-tr,"Merhaba, ilgili ürün için sipariş verdiyseniz, tahmini teslimat tarihini ''Hesabım-Siparişlerim'' alanından ilgili ürün için ''Tahmini Kargoya Teslim'' alanından tarihini kontrol edebilirsiniz. Eğer sipariş vermediyseniz, ürünü sepetinize eklediğinizde ürün görselinin sağında tahmini kargoya verilme süresine dair bilgilendirmeye ulaşabilirsiniz. Platformumuzdaki arama kısmına bulmak istediğiniz ürünü yazıp ekranın sol tarafında bulunan filtreleri kullanarak istediğiniz ürünü inceleyebilirsiniz. Aradığınız ürünün stoklarımızda mevcut olması halinde sipariş verebilirsiniz. Keyifli alışverişler dileriz.",ar-ae,,"مرحبًا، إذا طلبت المنتج ذي الصلة، يمكنك التحقق من تاريخ التسليم المقدر في منطقة ""حساب الشحن المقدر"" الخاصة بالمنتج. إذا لم تقم بالطلب، يمكنك الحصول على وقت الشحن المقدر على يمين صورة المنتج عند إضافته إلى سلة التسوق الخاصة بك. اكتب العنصر الذي تريده على منصتنا واستخدم المرشحات الموجودة على الجانب الأيسر من الشاشة. يمكنك الطلب إذا كان المنتج الذي تبحث عنه متوفرًا في المخزون. نتمنى لكم تسوقاً ممتعاً.",42713792,,,41680,,Evaluation Blocked,,,102.19435736677116
product-core_content-name_947549540_1,947549540_1,product-core,content-name,2025-06-23 13:15:50.202320 UTC,tr-tr,mazzıdağ Spiralli Defter Sert Kapak 192 Sayfa 96 Yaprak 17x24 Cm Noktalı new store 1133631,ar-ae,Mazzıdağ Spiral Notebook Hard Cover 192 Pages 96 Sheets 17X24 cm Dotted New Store 1133631,مذكرة مزدوجة حلزونية غطاء صلب 192 صفحة 96 ورقة 17x24 سم منقط متجر جديد 1133631,947549540,Alibaba,,9739,https://www.trendyol.com/ar/pname-p-947549540,OK,,,73.4375
product-core_content-description_966719189_1,966719189_1,product-core,content-description,2025-08-06 10:06:16.467273 UTC,tr-tr,Anzarun Lite Bold Günlük Ayakkabı Siyah,ar-ae,Anzarun lite bold daily shoes black,أحذية أسانرون لايت بولد اليومية السوداء,966719189,Alibaba,1935761.0,32661,https://www.trendyol.com/ar/pname-p-966719189,Not OK,Accuracy,,100.0
product-core_content-description_773763843_1,773763843_1,product-core,content-description,2025-05-06 13:08:55.573072 UTC,tr-tr,Anzarun Lite Spor Ayakkabı,ar-ae,,حذاء أنزارون لايت الرياضي,773763843,Alibaba,2080656.0,92071,https://www.trendyol.com/ar/pname-p-773763843,OK,,,100.0
product-core_content-description_886838801_43,886838801_43,product-core,content-description,2025-07-01 13:43:17.471595 UTC,tr-tr,Kruz Profoam AC+ PS Sneaker For All Time Red-PUMA Black,ar-ae,Kruz profoam ac+ ps sneaker for all time red-puma black,حذاء رياضي كروز بروفوم AC+ PS من أجل كل العصور باللون الأحمر-PUMA باللون الأسود,886838801,Alibaba,2817329.0,36089,https://www.trendyol.com/ar/pname-p-886838801,Not OK,Terminology,,87.5
product-core_content-name_845122344_35,845122344_35,product-core,content-name,2025-05-05 06:43:54.909308 UTC,tr-tr,Vizon-Açık Yeşil-Beyaz Slim/Dar Kesim Bisiklet Yaka %100 Pamuklu 3'lü Paket T-Shirt TMNSS19BO0007,ar-ae,,تي شيرت Mink-Light Green-White Slim/Slim Cut برقبة دائرية 100% قطن مكون من 3 قطع TMNSS19BO0007,845122344,,,50058,,Not OK,مجموعة من 3 قمصان بألوان المينك والأخضر الفاتح والأبيض، مصنوعة من القطن بنسبة 100% وبقصة ضيقة ورقبة دائرية Tmnss19Bo0007,Some words are left in EN,38.15789473684211
ugc-rr_customer-review_121362090_12173095,121362090_12173095,ugc-rr,customer-review,2025-06-28 22:39:04.474005 UTC,tr-tr,Umarım faydalı olur temelim sıfır,ar-ae,I hope it is useful my basis is zero,آمل أن يكون هذا مفيدًا، فأساسي هو الصفر,121362090,Alibaba,,3013,https://www.trendyol.com/ar/pname-p-121362090,Not OK,,,106.66666666666667
product-core_content-name_760541625_1,760541625_1,product-core,content-name,2025-08-19 05:28:30.706767 UTC,tr-tr,Koyu Mavi More Sustainable Yıkama Efektli Bol Kesim Yüksek Bel Loose Baggy Jeans TWOAW24JE00308,ar-ae,Dark Blue More Sustainable Wash Effect Loose Cut High Waist Loose Baggy Jeans Twoaw24Je00308,بنطلون جينز فضفاض ذو قصة واسعة وخصر عالٍ بتأثير غسيل مستدام أكثر باللون الأزرق الداكن TWOAW24JE00308,760541625,Alibaba,1039358.0,69744,https://www.trendyol.com/ar/pname-p-760541625,Not OK,Accuracy,,84.52380952380952
product-core_content-name_3952777_35,3952777_35,product-core,content-name,2025-03-28 17:15:34.091977 UTC,tr-tr,%100 Doğal Roll-on Kadın Deodorant Ter Kokusu Önleyici Bitkisel Leke Bırakmayan Vegan 50 ml,ar-ae,,مزيل عرق نسائي طبيعي 100% مضاد للعرق ومضاد للبقع نباتي نباتي 50 مل,3952777,,,78276,,Not OK,,,90.56603773584906
product-core_content-name_902983413_35,902983413_35,product-core,content-name,2025-02-28 13:50:51.835831 UTC,tr-tr,MNSWCLUBJSYSHORT,ar-ae,,MNSWCLUBJSYSHORT,902983413,,,9140,,Evaluation Blocked,,,0.0
product-core_content-name_902983397_35,902983397_35,product-core,content-name,2025-02-28 13:50:51.824158 UTC,tr-tr,COURT BOROUGH LOW RECRAFT BTV,ar-ae,,كورت بوروج منخفض التصنيع BTV,902983397,,,52531,,Not OK,,transliteration + literal translation,87.5
product-core_content-description_965748493_1,965748493_1,product-core,content-description,2025-08-05 08:54:09.983279 UTC,tr-tr,adidas Cloudfoam Move Erkek Koşu Ayakkabısı ID6528 Siyah,ar-ae,Adidas cloudfoam move men's running shoes id6528 black,حذاء الجري adidas Cloudfoam Move للرجال ID6528 أسود,965748493,Alibaba,2314628.0,61605,https://www.trendyol.com/ar/pname-p-965748493,OK,,,43.18181818181818
product-core_content-name_922666396_1,922666396_1,product-core,content-name,2025-08-20 13:32:17.246349 UTC,tr-tr,530 SUMMER FOG,ar-ae,530 summer fog,530 ضباب الصيف,922666396,Alibaba,1237624.0,19274,https://www.trendyol.com/ar/pname-p-922666396,Not OK,Terminology,,75.0
product-core_content-name_920741442_35,920741442_35,product-core,content-name,2025-03-18 08:43:46.443113 UTC,tr-tr,AE Long-Sleeve Linen-Blend Button-Up Shirt,ar-ae,,قميص AE بأكمام طويلة ومزود بأزرار,920741442,,,94854,,Not OK,قميص يحتوي على الكتان، بأكمام طويلة ومزود بأزرار من AE,,92.85714285714286
product-core_content-name_898634434_1,898634434_1,product-core,content-name,2025-02-17 11:35:33.414170 UTC,tr-tr,Bordo-Gri-Lacivert 3'lü Paket Slim/Dar Kesim Basic %100 Pamuk Tok Kumaş T-shirt TMNSS19BO0007,ar-ae,Burgundy-Grey-Navy Blue 3 Pack Slim/Narrow Cut Basic 100% Cotton T-Shirts Tmnss19Bo0007,تي شيرت أساسي مصنوع من القطن بنسبة 100% باللون العنابي والرمادي والأزرق الداكن مكون من 3 قطع TMNSS19BO0007,898634434,Alibaba,3905083.0,7127,https://www.trendyol.com/ar/pname-p-898634434,Not OK,Accuracy,,80.68181818181817
product-core_content-name_957301607_1,957301607_1,product-core,content-name,2025-07-16 13:04:38.337790 UTC,tr-tr,- Önü Yazı Detaylı Basic T-Shirt-Siyah,ar-ae,- Basic T-Shirt with Text Detail on the Front-Black,- تي شيرت أساسي بتفاصيل نص أمامي - أسود,957301607,Alibaba,4358529.0,41486,https://www.trendyol.com/ar/pname-p-957301607,Not OK,Accuracy,,100.0
ugc-rr_customer-review_746100682_48778138,746100682_48778138,ugc-rr,customer-review,2025-07-03 22:51:39.161848 UTC,tr-tr,Tesettürlüyüm azıcık uzun olmasını isterdim,ar-ae,"I wear hijab, I wish it was a little longer.",أرتدي الحجاب، وأتمنى أن يكون أطول قليلاً,746100682,Alibaba,20022760.0,78546,https://www.trendyol.com/ar/pname-p-746100682,Not OK,Accuracy,,106.25
product-core_content-name_386260904_1,386260904_1,product-core,content-name,2025-06-25 11:10:54.508815 UTC,tr-tr,Far Fıskiye Kapağı Sağ Doblo Jet 09-15,ar-ae,Headlight Bubbler Cover Right Doblo Jet 09-15,غطاء رأس الرشاش الأيمن Doblo Jet 09-15,386260904,Alibaba,,2680,https://www.trendyol.com/ar/pname-p-386260904,Not OK,,,61.29032258064516
product-core_content-name_380669772_1,380669772_1,product-core,content-name,2025-07-22 08:55:35.494813 UTC,tr-tr,Tensaur Hook and Loop Ayakkabı,ar-ae,Tensaur Hook and Loop Shoes,أحذية Tensaur Hook and Loop,380669772,Alibaba,2614642.0,70467,https://www.trendyol.com/ar/pname-p-380669772,Not OK,Accuracy,,21.73913043478261
product-core_content-name_951844298_1,951844298_1,product-core,content-name,2025-07-03 12:31:46.252102 UTC,tr-tr,Puma Shuffle Erkek Günlük Ayakkabı 30966803 Beyaz,ar-ae,Puma Shuffle Men's Casual Shoes30966803 White,بوما شوفل أحذية رجالية عادية30966803 أبيض,951844298,Alibaba,1579901.0,84923,https://www.trendyol.com/ar/pname-p-951844298,Not OK,Accuracy,,77.77777777777779
product-core_content-name_920741462_35,920741462_35,product-core,content-name,2025-03-18 08:43:46.420841 UTC,tr-tr,AE Logo Graphic T-Shirt,ar-ae,,تي شيرت برسومات شعار AE,920741462,,,61413,,Evaluation Blocked,,,89.47368421052632
product-core_content-description_967606559_1,967606559_1,product-core,content-description,2025-08-07 08:20:04.142219 UTC,tr-tr,PUMA Skyrocket Lıte Elevate Erkek Skyrocket Lıte Elevate 31149402 Renkli,ar-ae,PUMA Skyrocket Lite Elevate Men's Skyrocket Lite Elevate 31149402 Colorful,PUMA Skyrocket Lite Elevate رجال Skyrocket Lite Elevate 31149402 ملون,967606559,ctms-translation-validation,3227551.0,61991,https://www.trendyol.com/ar/pname-p-967606559,Not OK,Accuracy,,13.333333333333334
ugc-rr_customer-review_828498459_41325157,828498459_41325157,ugc-rr,customer-review,2025-01-13 21:29:18.743438 UTC,tr-tr,çok hafif ayakkabı rahat orijinal mi pek Anlayamadım ama kullanışlı beğendim,ar-ae,,حذاء خفيف جداً، مريح، هل هو أصلي؟ لم أفهمها لكني أحببتها مفيدة,828498459,,,671,,Evaluation Blocked,,,108.51063829787233
prod-qna_prod-qna_42713792_144594679_q,42713792_144594679_q,prod-qna,prod-qna,2025-04-11 22:49:48.967085 UTC,tr-tr,SLM aleyküm hayırlı işler makinede yıkamaya uygunmudur,ar-ae,,SLM عليكم، عمل جيد، هل هو مناسب للغسيل في الغسالة؟,42713792,,,63841,,Not OK,,,100.0
product-core_content-name_880668171_1,880668171_1,product-core,content-name,2025-06-23 13:29:03.863001 UTC,tr-tr,SEAT TOLEDO- 13/17; RADYATÖR FAN DAVLUMBAZI,ar-ae,Seat toledo- 13/17; radiator fan cover,مروحة الرادياتير توليدو - 13/17,880668171,Alibaba,,71624,https://www.trendyol.com/ar/pname-p-880668171,Not OK,,,84.0
product-core_content-name_788016417_1,788016417_1,product-core,content-name,2025-06-25 05:04:23.192775 UTC,tr-tr,LCW ACCESSORIES Kamuflaj Baskılı Erkek Çocuk Eldiven,ar-ae,LCW ACCESSORIES Camouflage Printed Boys' Gloves,LCW ACCESSORIES قفازات للأولاد مطبوعة مموهة,788016417,Alibaba,,68905,https://www.trendyol.com/ar/pname-p-788016417,Not OK,,,63.1578947368421
product-core_content-name_871568972_1,871568972_1,product-core,content-name,2025-06-25 02:50:49.001619 UTC,tr-tr,Marsilyan- Beyaz Emay 2020 Double String Korse,ar-ae,Marsilyan-White Emay 2020 Double String Corset,مشد مارسيليان- وايت إيماي 2020 ذو سلسلة مزدوجة,871568972,Alibaba,,50196,https://www.trendyol.com/ar/pname-p-871568972,Not OK,,,89.47368421052632
product-core_content-name_835657149_1,835657149_1,product-core,content-name,2025-06-23 13:25:11.814480 UTC,tr-tr,Opel Combo- 04/12; Sis Lamba Kapağı Sağ Siyah Siyahdelikli,ar-ae,Opel Combo- 04/12; Fog Lamp Cover Right Black with Black Hole,أوبل كومبو- 04/12; غطاء مصباح الضباب يمين أسود مع فتحة سوداء,835657149,Alibaba,,14530,https://www.trendyol.com/ar/pname-p-835657149,Not OK,,,91.48936170212765
product-core_content-description_838693091_1,838693091_1,product-core,content-description,2025-07-10 06:05:29.655736 UTC,tr-tr,Puma Club II Era Sneaker,ar-ae,Puma Club II Era Sneaker,حذاء سنيكرز من عصر النادي الثاني من بوما,838693091,Alibaba,4348021.0,95020,https://www.trendyol.com/ar/pname-p-838693091,Not OK,Terminology,,100.0
product-core_content-name_946280545_1,946280545_1,product-core,content-name,2025-06-19 11:01:53.081838 UTC,tr-tr,252SY916 Model Sarach Marka Siyah Renk Omuz Çantası,ar-ae,252Sy916 Model Sarach Brand Black Color Shoulder Bag,252SY916 حقيبة كتف موديل ساراش ماركة لون أسود,946280545,Alibaba,,48087,https://www.trendyol.com/ar/pname-p-946280545,Not OK,,,78.94736842105263
product-core_content-name_942064868_1,942064868_1,product-core,content-name,2025-06-02 19:36:35.849577 UTC,tr-tr,Erkek Pileli Kumaş Pantolon,ar-ae,Men's Pleated Fabric Trousers,بنطلون قماش مطوي للرجال,942064868,Alibaba,,28732,https://www.trendyol.com/ar/pname-p-942064868,Not OK,,,100.0
product-core_content-name_840250756_35,840250756_35,product-core,content-name,2025-04-08 12:38:59.485024 UTC,tr-tr,Hakiki Deri Saç Örgü Günlük Kadın Sandalet,ar-ae,,صنادل نسائية يومية من الجلد الطبيعي,840250756,,,94628,,Not OK,,missing information,100.0
product-core_content-name_359378962_1,359378962_1,product-core,content-name,2024-04-16 03:06:44.915064 UTC,tr-tr,6'lı Kokteyl Peçetesi Alice Altın Sim,ar-ae,6-Piece Cocktail Napkin Alice Gold Glitter,منديل كوكتيل مكون من 6 قطع أليس جولد جليتر,359378962,,,46542,https://www.trendyol.com/ar/pname-p-359378962,Not OK,,,97.05882352941177
product-core_content-description_896473192_1,896473192_1,product-core,content-description,2025-05-09 11:44:06.744418 UTC,tr-tr,Runfalcon 5 günlük spor ayakkabı sneaker ;,ar-ae,,حذاء رياضي رياضي غير رسمي من رنفالكون 5 ;,896473192,DeepL,6475366.0,23343,https://www.trendyol.com/ar/pname-p-896473192,Evaluation Blocked,,,96.875
prod-qna_prod-qna_470293693_266638336_q,470293693_266638336_q,prod-qna,prod-qna,2025-06-17 10:34:07.301822 UTC,tr-tr,kalıpları büyük.mu bol durmasini istiyorum,ar-ae,Is the size large? I want it to be loose.,هل الأنماط كبيرة؟أريد أن تكون فضفاضة.,470293693,Alibaba,,48941,https://www.trendyol.com/ar/pname-p-470293693,Not OK,,,103.33333333333334
product-core_content-description_122430746_1,122430746_1,product-core,content-description,2025-08-08 21:13:45.481493 UTC,tr-tr,ERKEK DÜZ PENYE BOXER 6 Adet,ar-ae,Men's Straight Combed Combed Boxer 6 Pieces,بوكسر رجالي مبطن 6 قطع,122430746,Alibaba,1177369.0,69435,https://www.trendyol.com/ar/pname-p-122430746,Not OK,Accuracy,,94.44444444444444
